<?xml version="1.0" encoding="Windows-1252"?>
<xs:schema xmlns="http://tempuri.org/TextFile1" elementFormDefault="qualified" targetNamespace="http://tempuri.org/TextFile1" xmlns:xs="http://www.w3.org/2001/XMLSchema">
	<xs:element name="rutas">
		<xs:complexType>
			<xs:sequence>
				<xs:element minOccurs="1" maxOccurs="unbounded" ref="ruta" />
			</xs:sequence>
			<xs:attribute name="provincia" type="xs:string" use="required" />
			<xs:attribute name="pais" type="xs:string" use="required" />
			<xs:attribute name="region" type="xs:string" use="required" />
		</xs:complexType>
	</xs:element>
	<xs:element name="ruta">
		<xs:complexType>
			<xs:sequence>
				<xs:element ref="nombre" />
				<xs:element ref="tipo" />
				<xs:element ref="medioTransporte" />
				<xs:element minOccurs="0" maxOccurs="1" ref="fechaInicio" />
				<xs:element minOccurs="0" maxOccurs="1" ref="horaInicio" />
				<xs:element ref="duracion" />
				<xs:element ref="agencia" />
				<xs:element ref="descripcion" />
				<xs:element ref="personasAdecuadas" />
				<xs:element ref="lugarInicio" />
				<xs:element ref="direccionInicio" />
				<xs:element ref="coordenadasInicio" />
				<xs:element ref="referencias" />
				<xs:element ref="recomendacion" />
				<xs:element ref="hitos" />
				<xs:element ref="puntosRuta" />
				<xs:element ref="planimetria" />
				<xs:element ref="altimetria" />
			</xs:sequence>
			<xs:attribute name="id" type="xs:ID" use="required" />
		</xs:complexType>
	</xs:element>
	<xs:element name="nombre" type="xs:string" />
	<xs:element name="tipo" type="xs:string" />
	<xs:element name="medioTransporte" type="xs:string" />
	<xs:element name="duracion" type="xs:string" />
	<xs:element name="agencia" type="xs:string" />
	<xs:element name="descripcion" type="xs:string" />
	<xs:element name="personasAdecuadas" type="xs:string" />
	<xs:element name="lugarInicio" type="xs:string" />
	<xs:element name="direccionInicio" type="xs:string" />
	<xs:element name="recomendacion" type="xs:string" />
	<xs:element name="planimetria" type="xs:string" />
	<xs:element name="altimetria" type="xs:string" />
	<xs:element name="fechaInicio">
		<xs:complexType>
			<xs:simpleContent>
				<xs:extension base="xs:string">
					<xs:attribute default="true" name="opcional">
						<xs:simpleType>
							<xs:restriction base="xs:NMTOKEN">
								<xs:enumeration value="true" />
								<xs:enumeration value="false" />
							</xs:restriction>
						</xs:simpleType>
					</xs:attribute>
				</xs:extension>
			</xs:simpleContent>
		</xs:complexType>
	</xs:element>
	<xs:element name="horaInicio">
		<xs:complexType>
			<xs:simpleContent>
				<xs:extension base="xs:string">
					<xs:attribute default="true" name="opcional">
						<xs:simpleType>
							<xs:restriction base="xs:NMTOKEN">
								<xs:enumeration value="true" />
								<xs:enumeration value="false" />
							</xs:restriction>
						</xs:simpleType>
					</xs:attribute>
				</xs:extension>
			</xs:simpleContent>
		</xs:complexType>
	</xs:element>
	<xs:element name="coordenadasInicio">
		<xs:complexType>
			<xs:sequence>
				<xs:element ref="longitud" />
				<xs:element ref="latitud" />
				<xs:element ref="altitud" />
			</xs:sequence>
		</xs:complexType>
	</xs:element>
	<xs:element name="coordenadas">
		<xs:complexType>
			<xs:sequence>
				<xs:element ref="longitud" />
				<xs:element ref="latitud" />
				<xs:element ref="altitud" />
			</xs:sequence>
		</xs:complexType>
	</xs:element>
	<xs:element name="longitud" type="xs:string" />
	<xs:element name="latitud" type="xs:string" />
	<xs:element name="altitud" type="xs:string" />
	<xs:element name="referencias">
		<xs:complexType>
			<xs:sequence>
				<xs:element ref="referencia" />
				<xs:element ref="referencia" />
				<xs:element ref="referencia" />
				<xs:element minOccurs="0" maxOccurs="unbounded" ref="referencia" />
			</xs:sequence>
		</xs:complexType>
	</xs:element>
	<xs:element name="referencia">
		<xs:complexType>
			<xs:simpleContent>
				<xs:extension base="xs:string">
					<xs:attribute name="id" type="xs:string" use="required" />
				</xs:extension>
			</xs:simpleContent>
		</xs:complexType>
	</xs:element>
	<xs:element name="hitos">
		<xs:complexType>
			<xs:sequence>
				<xs:element ref="hito" />
				<xs:element ref="hito" />
				<xs:element ref="hito" />
				<xs:element ref="hito" />
				<xs:element ref="hito" />
				<xs:element minOccurs="0" maxOccurs="unbounded" ref="hito" />
			</xs:sequence>
		</xs:complexType>
	</xs:element>
	<xs:element name="hito">
		<xs:complexType>
			<xs:sequence>
				<xs:element ref="nombre" />
				<xs:element ref="descripcion" />
				<xs:element ref="coordenadas" />
				<xs:element ref="distanciaDesdeAnterior" />
				<xs:element ref="galeriaFotos" />
				<xs:element minOccurs="0" maxOccurs="1" ref="galeriaVideos" />
			</xs:sequence>
			<xs:attribute name="id" type="xs:ID" use="required" />
		</xs:complexType>
	</xs:element>
	<xs:element name="distanciaDesdeAnterior">
		<xs:complexType>
			<xs:simpleContent>
				<xs:extension base="xs:string">
					<xs:attribute name="unidades" use="required">
						<xs:simpleType>
							<xs:restriction base="xs:NMTOKEN">
								<xs:enumeration value="km" />
								<xs:enumeration value="m" />
								<xs:enumeration value="mi" />
							</xs:restriction>
						</xs:simpleType>
					</xs:attribute>
				</xs:extension>
			</xs:simpleContent>
		</xs:complexType>
	</xs:element>
	<xs:element name="galeriaFotos">
		<xs:complexType>
			<xs:sequence>
				<xs:element ref="foto" />
				<xs:element minOccurs="0" maxOccurs="1" ref="foto" />
				<xs:element minOccurs="0" maxOccurs="1" ref="foto" />
				<xs:element minOccurs="0" maxOccurs="1" ref="foto" />
				<xs:element minOccurs="0" maxOccurs="1" ref="foto" />
			</xs:sequence>
		</xs:complexType>
	</xs:element>
	<xs:element name="foto">
		<xs:complexType>
			<xs:simpleContent>
				<xs:extension base="xs:string">
					<xs:attribute name="alt" type="xs:string" use="required" />
				</xs:extension>
			</xs:simpleContent>
		</xs:complexType>
	</xs:element>
	<xs:element name="galeriaVideos">
		<xs:complexType>
			<xs:sequence>
				<xs:element ref="video" />
				<xs:element minOccurs="0" maxOccurs="1" ref="video" />
				<xs:element minOccurs="0" maxOccurs="1" ref="video" />
			</xs:sequence>
		</xs:complexType>
	</xs:element>
	<xs:element name="video">
		<xs:complexType>
			<xs:simpleContent>
				<xs:extension base="xs:string">
					<xs:attribute name="alt" type="xs:string" use="required" />
				</xs:extension>
			</xs:simpleContent>
		</xs:complexType>
	</xs:element>
	<xs:element name="puntosRuta">
		<xs:complexType>
			<xs:sequence>
				<xs:element minOccurs="1" maxOccurs="unbounded" ref="punto" />
			</xs:sequence>
		</xs:complexType>
	</xs:element>
	<xs:element name="punto">
		<xs:complexType>
			<xs:attribute name="longitud" type="xs:string" use="required" />
			<xs:attribute name="latitud" type="xs:string" use="required" />
			<xs:attribute name="altitud" type="xs:string" />
		</xs:complexType>
	</xs:element>
</xs:schema>